indicator_id,indicator_name,needs_assessment_domain,indicator_summary,indicator_detailed_description,source_name,source_agency,api_or_download,geography_name,geography_type,state_fips,county_fips,year_or_period,source_latest_year_or_period,estimate,moe,numerator,denominator,units,unit_definition,unit_source,source_variable_label,stratification,comparison_available,data_quality_note,source_url_or_endpoint,source_citation_id,source_citation_text,retrieved_at
HISPANIC_LATINX_PCT,Hispanic or Latinx population percentage,Demographics,Share of residents who identify as Hispanic or Latinx.,Helps compare community demographics with client demographics and language capacity.,ACS 5-year Detailed Tables,U.S. Census Bureau,API / calculated,United States,United States,,,2024,2024,19.335628449374493,,64759370.0,334922499.0,percent,"Hispanic/Latinx population divided by total population, multiplied by 100.",Calculated by script from ACS numerator and denominator.,B03003_003E; B01001_001E,Total,Yes,Most recent ACS 5-year detailed table detected independently for ACS source. Derived percentage calculated by script; MOE for derived percentage not calculated.,https://api.census.gov/data/2024/acs/acs5,CENSUS_ACS_API,U.S. Census ACS API: American Community Survey API. U.S. Census Bureau. Ongoing. https://api.census.gov/data.html.,2026-06-11T16:20:51.390667+00:00
AIAN_POPULATION_COUNT,American Indian and Alaska Native population,Demographics,Number of residents identifying as American Indian or Alaska Native alone.,"Supports assessment of Indigenous community needs, tribal partnerships, and cultural responsiveness.",ACS 5-year Detailed Tables,U.S. Census Bureau,API,United States,United States,,,2024,2024,3095754.0,19785.0,3095754.0,334922499.0,people,Number of people identifying as American Indian or Alaska Native alone.,Static indicator definition based on ACS count variable.,B02001_004E; B01001_001E,Total,Yes,Most recent ACS 5-year detailed table detected independently for ACS source.,https://api.census.gov/data/2024/acs/acs5,CENSUS_ACS_API,U.S. Census ACS API: American Community Survey API. U.S. Census Bureau. Ongoing. https://api.census.gov/data.html.,2026-06-11T16:20:51.390821+00:00
AIAN_POPULATION_PCT,American Indian and Alaska Native population percentage,Demographics,Share of residents identifying as American Indian or Alaska Native alone.,Supports comparison of community population and served-client demographics.,ACS 5-year Detailed Tables,U.S. Census Bureau,API / calculated,United States,United States,,,2024,2024,0.9243195095113631,,3095754.0,334922499.0,percent,"AIAN-alone population divided by total population, multiplied by 100.",Calculated by script from ACS numerator and denominator.,B02001_004E; B01001_001E,Total,Yes,Most recent ACS 5-year detailed table detected independently for ACS source. Derived percentage calculated by script; MOE for derived percentage not calculated.,https://api.census.gov/data/2024/acs/acs5,CENSUS_ACS_API,U.S. Census ACS API: American Community Survey API. U.S. Census Bureau. Ongoing. https://api.census.gov/data.html.,2026-06-11T16:20:51.390974+00:00
VETERAN_POPULATION_COUNT,Veteran population,Underserved Populations,Number of civilian veterans.,"Supports veteran outreach, trauma-informed care, suicide prevention, and coordination with VA/community veteran resources.",ACS 5-year Detailed Tables,U.S. Census Bureau,API,United States,United States,,,2024,2024,16185883.0,45251.0,16185883.0,260112316.0,people,Number of civilian veterans age 18 and older.,Static indicator definition based on ACS count variable.,B21001_002E; B21001_001E,Total,Yes,Veteran percentage uses ACS B21001 civilian population age 18+ denominator.,https://api.census.gov/data/2024/acs/acs5,CENSUS_ACS_API,U.S. Census ACS API: American Community Survey API. U.S. Census Bureau. Ongoing. https://api.census.gov/data.html.,2026-06-11T16:20:51.391143+00:00
VETERAN_POPULATION_PCT,Veteran population percentage,Underserved Populations,Share of adult civilian population that is veteran.,Helps compare veteran community size with veteran representation among clients.,ACS 5-year Detailed Tables,U.S. Census Bureau,API / calculated,United States,United States,,,2024,2024,6.222651525658631,,16185883.0,260112316.0,percent,"Veteran population divided by civilian population age 18+, multiplied by 100.",Calculated by script from ACS numerator and denominator.,B21001_002E; B21001_001E,Total,Yes,Veteran percentage uses ACS B21001 civilian population age 18+ denominator. Derived percentage calculated by script; MOE for derived percentage not calculated.,https://api.census.gov/data/2024/acs/acs5,CENSUS_ACS_API,U.S. Census ACS API: American Community Survey API. U.S. Census Bureau. Ongoing. https://api.census.gov/data.html.,2026-06-11T16:20:51.391296+00:00
LANGUAGE_LEP_SPANISH_COUNT,Spanish speakers who speak English less than very well,Culture and Language,Number of Spanish-speaking residents with limited English proficiency.,"Supports bilingual staff, interpretation, translation, outreach materials, and culturally responsive access planning.",ACS 5-year Detailed Tables,U.S. Census Bureau,API,United States,United States,,,2024,2024,17218782.0,106783.0,17218782.0,316142548.0,people,Number of people age 5+ who speak Spanish at home and speak English less than very well.,Static indicator definition based on ACS count variable.,C16001_005E; C16001_001E,Total,Yes,Spanish LEP uses ACS C16001 population age 5+ language table.,https://api.census.gov/data/2024/acs/acs5,CENSUS_ACS_API,U.S. Census ACS API: American Community Survey API. U.S. Census Bureau. Ongoing. https://api.census.gov/data.html.,2026-06-11T16:20:51.391449+00:00
LANGUAGE_LEP_SPANISH_PCT,Spanish limited-English-proficiency percentage,Culture and Language,Share of residents age 5+ who speak Spanish at home and speak English less than very well.,Helps size Spanish-language assistance needs relative to population age 5+.,ACS 5-year Detailed Tables,U.S. Census Bureau,API / calculated,United States,United States,,,2024,2024,5.446524711377982,,17218782.0,316142548.0,percent,"Spanish LEP population divided by population age 5+, multiplied by 100.",Calculated by script from ACS numerator and denominator.,C16001_005E; C16001_001E,Total,Yes,Spanish LEP uses ACS C16001 population age 5+ language table. Derived percentage calculated by script; MOE for derived percentage not calculated.,https://api.census.gov/data/2024/acs/acs5,CENSUS_ACS_API,U.S. Census ACS API: American Community Survey API. U.S. Census Bureau. Ongoing. https://api.census.gov/data.html.,2026-06-11T16:20:51.391599+00:00
NO_VEHICLE_HOUSEHOLDS_COUNT,Households with no vehicle available,Transportation,Number of households with no vehicle available.,Supports transportation-barrier assessment and mobile/telehealth planning.,ACS 5-year Detailed Tables,U.S. Census Bureau,API,United States,United States,,,2024,2024,10793323.0,27221.0,10793323.0,129227496.0,households,Number of households reporting no vehicle available.,Static indicator definition based on ACS count variable.,B08201_002E; B08201_001E,Total,Yes,No-vehicle percentage uses ACS B08201 household denominator.,https://api.census.gov/data/2024/acs/acs5,CENSUS_ACS_API,U.S. Census ACS API: American Community Survey API. U.S. Census Bureau. Ongoing. https://api.census.gov/data.html.,2026-06-11T16:20:51.391755+00:00
NO_VEHICLE_HOUSEHOLDS_PCT,Households with no vehicle available percentage,Transportation,Share of households with no vehicle available.,Quantifies transportation vulnerability relative to all households.,ACS 5-year Detailed Tables,U.S. Census Bureau,API / calculated,United States,United States,,,2024,2024,8.352187679934616,,10793323.0,129227496.0,percent,"No-vehicle households divided by total households, multiplied by 100.",Calculated by script from ACS numerator and denominator.,B08201_002E; B08201_001E,Total,Yes,No-vehicle percentage uses ACS B08201 household denominator. Derived percentage calculated by script; MOE for derived percentage not calculated.,https://api.census.gov/data/2024/acs/acs5,CENSUS_ACS_API,U.S. Census ACS API: American Community Survey API. U.S. Census Bureau. Ongoing. https://api.census.gov/data.html.,2026-06-11T16:20:51.391926+00:00
SNAP_HOUSEHOLDS_COUNT,Households receiving SNAP,Food/Nutrition,Number of households receiving SNAP.,Proxy for food/economic insecurity and partnership needs.,ACS 5-year Detailed Tables,U.S. Census Bureau,API,United States,United States,,,2024,2024,15572114.0,49058.0,15572114.0,129227496.0,households,Number of households receiving Food Stamps/SNAP in the past 12 months.,Static indicator definition based on ACS count variable.,B22010_002E; B22010_001E,Total,Yes,SNAP percentage uses ACS B22010 household denominator.,https://api.census.gov/data/2024/acs/acs5,CENSUS_ACS_API,U.S. Census ACS API: American Community Survey API. U.S. Census Bureau. Ongoing. https://api.census.gov/data.html.,2026-06-11T16:20:51.392085+00:00
SNAP_HOUSEHOLDS_PCT,Households receiving SNAP percentage,Food/Nutrition,Share of households receiving SNAP.,Shows SNAP participation relative to all households.,ACS 5-year Detailed Tables,U.S. Census Bureau,API / calculated,United States,United States,,,2024,2024,12.050155332267677,,15572114.0,129227496.0,percent,"SNAP households divided by total households, multiplied by 100.",Calculated by script from ACS numerator and denominator.,B22010_002E; B22010_001E,Total,Yes,SNAP percentage uses ACS B22010 household denominator. Derived percentage calculated by script; MOE for derived percentage not calculated.,https://api.census.gov/data/2024/acs/acs5,CENSUS_ACS_API,U.S. Census ACS API: American Community Survey API. U.S. Census Bureau. Ongoing. https://api.census.gov/data.html.,2026-06-11T16:20:51.392231+00:00
RENT_BURDENED_HOUSEHOLDS_COUNT,Rent-burdened households,Housing Stability,Number of renter households spending 30% or more of income on rent.,Supports housing affordability and recovery-stability analysis.,ACS 5-year Detailed Tables,U.S. Census Bureau,API / calculated,United States,United States,,,2024,2024,21422415.0,63960.51251358138,21422415.0,45017354.0,households,Renter households with gross rent equal to 30% or more of income.,Calculated by script from ACS rent-burden category counts.,B25070_007E; B25070_008E; B25070_009E; B25070_010E; B25070_001E,Total,Yes,Rent-burdened households calculated from ACS B25070 categories for 30% or more of income. Sum MOE approximated.,https://api.census.gov/data/2024/acs/acs5,CENSUS_ACS_API,U.S. Census ACS API: American Community Survey API. U.S. Census Bureau. Ongoing. https://api.census.gov/data.html.,2026-06-11T16:20:51.392434+00:00
RENT_BURDENED_HOUSEHOLDS_PCT,Rent-burdened households percentage,Housing Stability,Share of renter households spending 30% or more of income on rent.,Quantifies housing affordability pressure among renters.,ACS 5-year Detailed Tables,U.S. Census Bureau,API / calculated,United States,United States,,,2024,2024,47.587014998704724,,21422415.0,45017354.0,percent,"Rent-burdened renter households divided by renter households with rent-burden data, multiplied by 100.",Calculated by script from ACS numerator and denominator.,B25070_007E; B25070_008E; B25070_009E; B25070_010E; B25070_001E,Total,Yes,Rent-burdened households calculated from ACS B25070 categories for 30% or more of income. Sum MOE approximated. Derived percentage calculated by script; MOE for derived percentage not calculated.,https://api.census.gov/data/2024/acs/acs5,CENSUS_ACS_API,U.S. Census ACS API: American Community Survey API. U.S. Census Bureau. Ongoing. https://api.census.gov/data.html.,2026-06-11T16:20:51.392590+00:00
MEDIAN_HOME_VALUE,Median home value,Housing Stability,Median value of owner-occupied housing units.,Supports interpretation of local cost pressures that may affect clients and workforce.,ACS 5-year Detailed Tables,U.S. Census Bureau,API,United States,United States,,,2024,2024,332700.0,236.0,,,dollars,Median value in dollars for owner-occupied housing units.,Static indicator definition based on ACS dollar variable.,B25077_001E; B25077_001M,Owner-occupied housing units,Yes,Most recent ACS 5-year detailed table detected independently for ACS source.,https://api.census.gov/data/2024/acs/acs5,CENSUS_ACS_API,U.S. Census ACS API: American Community Survey API. U.S. Census Bureau. Ongoing. https://api.census.gov/data.html.,2026-06-11T16:20:51.392847+00:00
MEDIAN_HOUSEHOLD_INCOME,Median household income,Economic Stability,Median household income in dollars.,"Provides broad household economic context for affordability, transportation, housing, and access barriers.",ACS 5-year Detailed Tables,U.S. Census Bureau,API,United States,United States,,,2024,2024,80734.0,166.0,,,dollars,Median household income in inflation-adjusted dollars for the ACS period.,Static indicator definition based on ACS dollar variable.,B19013_001E; B19013_001M,Households,Yes,Most recent ACS 5-year detailed table detected independently for ACS source.,https://api.census.gov/data/2024/acs/acs5,CENSUS_ACS_API,U.S. Census ACS API: American Community Survey API. U.S. Census Bureau. Ongoing. https://api.census.gov/data.html.,2026-06-11T16:20:51.393176+00:00
POVERTY_RATE,Population below poverty level,Economic Stability,Percentage of residents below the federal poverty level.,"Supports assessment of economic hardship as a barrier to behavioral health access, insurance, transportation, housing, nutrition, and ability to pay.",ACS 5-year Data Profile,U.S. Census Bureau,API,United States,United States,,,2024,2024,12.5,0.1,,,percent,Percentage of people for whom poverty status is determined who are below the federal poverty level.,Static indicator definition based on ACS profile percentage variable.,DP03_0128PE: Selected Economic Characteristics - Percent!!PERCENTAGE OF FAMILIES AND PEOPLE WHOSE INCOME IN THE PAST 12 MONTHS IS BELOW THE POVERTY LEVEL!!All people; DP03_0128PM,Total,Yes,Most recent ACS 5-year profile endpoint detected independently for ACS source.,https://api.census.gov/data/2024/acs/acs5/profile,CENSUS_ACS_API,U.S. Census ACS API: American Community Survey API. U.S. Census Bureau. Ongoing. https://api.census.gov/data.html.,2026-06-11T16:20:52.049422+00:00
UNINSURED_RATE,Uninsured rate,Insurance Coverage,Percentage of residents without health insurance coverage.,"Supports assessment of safety-net role, charity/sliding-fee needs, and outreach to uninsured residents.",ACS 5-year Data Profile,U.S. Census Bureau,API,United States,United States,,,2024,2024,8.4,0.1,,,percent,Percentage of civilian noninstitutionalized population with no health insurance coverage.,Static indicator definition based on ACS profile percentage variable.,DP03_0099PE: Selected Economic Characteristics - Percent!!HEALTH INSURANCE COVERAGE!!Civilian noninstitutionalized population!!No health insurance coverage; DP03_0099PM,Total,Yes,Most recent ACS 5-year profile endpoint detected independently for ACS source.,https://api.census.gov/data/2024/acs/acs5/profile,CENSUS_ACS_API,U.S. Census ACS API: American Community Survey API. U.S. Census Bureau. Ongoing. https://api.census.gov/data.html.,2026-06-11T16:20:52.049517+00:00
PUBLIC_COVERAGE_RATE,Public health insurance coverage rate,Insurance Coverage,Percentage of residents with public health insurance coverage.,"Supports payer-mix and safety-net analysis. This is public coverage, not Medicaid-only.",ACS 5-year Data Profile,U.S. Census Bureau,API,United States,United States,,,2024,2024,36.7,0.1,,,percent,Percentage of civilian noninstitutionalized population with public health insurance coverage.,Static indicator definition based on ACS profile percentage variable DP03_0098PE.,DP03_0098PE: Selected Economic Characteristics - Percent!!HEALTH INSURANCE COVERAGE!!Civilian noninstitutionalized population!!With health insurance coverage!!With public coverage; DP03_0098PM,Total,Yes,Most recent ACS 5-year profile endpoint detected independently for ACS source.,https://api.census.gov/data/2024/acs/acs5/profile,CENSUS_ACS_API,U.S. Census ACS API: American Community Survey API. U.S. Census Bureau. Ongoing. https://api.census.gov/data.html.,2026-06-11T16:20:52.049582+00:00
DISABILITY_COUNT,Population with a disability,Underserved Populations,Number of residents with a disability.,"Supports assessment of accessibility, care coordination, physical access, telehealth access, and integrated care needs.",ACS 5-year Subject Tables,U.S. Census Bureau,API,United States,United States,,,2024,2024,43869797.0,106767.0,43869797.0,,people,Number of civilian noninstitutionalized people with a disability.,Static indicator definition based on ACS subject count variable.,S1810_C02_001E: Disability Characteristics - Estimate!!With a disability!!Total civilian noninstitutionalized population; S1810_C02_001M,Civilian noninstitutionalized population,Yes,Most recent ACS 5-year subject endpoint detected independently for ACS source.,https://api.census.gov/data/2024/acs/acs5/subject,CENSUS_ACS_API,U.S. Census ACS API: American Community Survey API. U.S. Census Bureau. Ongoing. https://api.census.gov/data.html.,2026-06-11T16:20:52.774477+00:00
DISABILITY_PREVALENCE,Disability prevalence,Underserved Populations,Share of residents with a disability.,"Supports comparison of disability prevalence across county, state, and U.S.",ACS 5-year Subject Tables,U.S. Census Bureau,API,United States,United States,,,2024,2024,13.3,0.1,,,percent,Percentage of civilian noninstitutionalized population with a disability.,Static indicator definition based on ACS subject percent variable.,S1810_C03_001E: Disability Characteristics - Estimate!!Percent with a disability!!Total civilian noninstitutionalized population; S1810_C03_001M,Civilian noninstitutionalized population,Yes,Most recent ACS 5-year subject endpoint detected independently for ACS source.,https://api.census.gov/data/2024/acs/acs5/subject,CENSUS_ACS_API,U.S. Census ACS API: American Community Survey API. U.S. Census Bureau. Ongoing. https://api.census.gov/data.html.,2026-06-11T16:20:52.774732+00:00
UNEMPLOYMENT_RATE,Unemployment rate,Economic Stability,Annual average unemployment rate.,Labor-market context for economic hardship and employment-related stress.,BLS LAUS,U.S. Bureau of Labor Statistics,API,IL,County,17,031,2025 December,2025 December,4.6,,,,percent,"Unemployed labor force divided by total labor force, multiplied by 100.",Static source definition based on BLS LAUS unemployment-rate series.,"LAUCN170310000000003: LAUS county unemployment rate, December.",December,No,Most recent BLS LAUS row returned for inferred county LAUS unemployment-rate series LAUCN170310000000003. Annual average M13 is preferred; latest monthly row is used only if M13 is unavailable. Validate series metadata before publication.,https://api.bls.gov/publicAPI/v2/timeseries/data/,BLS_LAUS_API,BLS Public Data API: Local Area Unemployment Statistics via BLS Public Data API. U.S. Bureau of Labor Statistics. Ongoing. https://api.bls.gov/publicAPI/v2/timeseries/data/.,2026-06-11T16:20:52.786584+00:00
FREQUENT_MENTAL_DISTRESS,Frequent mental distress,Mental Health Prevalence and Outcomes,Estimated prevalence of frequent mental distress.,Estimates adults reporting frequent mental distress and helps identify population-level mental health burden.,CDC PLACES,Centers for Disease Control and Prevention,API / Socrata,Cook,County,17,031,2023,2023,15.4,,,,percent,Percent of relevant adult population.,"CDC PLACES API metadata, normalized from source unit.",measure=Frequent mental distress among adults; measureid=MHLTH; category=Health Status; short_question_text=Frequent Mental Distress; data_value_type=Age-adjusted prevalence,Frequent mental distress among adults,Partial,Most recent matching CDC PLACES county row returned from tried Socrata endpoint; modeled estimate; validate endpoint/release before final reporting.,https://data.cdc.gov/resource/swc5-untb.json,CDC_PLACES_API,CDC PLACES API: CDC PLACES Local Data for Better Health. Centers for Disease Control and Prevention. Ongoing. https://data.cdc.gov/.,2026-06-11T16:20:52.789478+00:00
DEPRESSION_PREVALENCE,Depression prevalence,Mental Health Prevalence and Outcomes,Estimated prevalence of depression.,Estimates adults reporting depression/current depression depending on PLACES measure returned.,CDC PLACES,Centers for Disease Control and Prevention,API / Socrata,Cook,County,17,031,2023,2023,19.0,,,,percent,Percent of relevant adult population.,"CDC PLACES API metadata, normalized from source unit.",measure=Depression among adults; measureid=DEPRESSION; category=Health Outcomes; short_question_text=Depression; data_value_type=Age-adjusted prevalence,Depression among adults,Partial,Most recent matching CDC PLACES county row returned from tried Socrata endpoint; modeled estimate; validate endpoint/release before final reporting.,https://data.cdc.gov/resource/swc5-untb.json,CDC_PLACES_API,CDC PLACES API: CDC PLACES Local Data for Better Health. Centers for Disease Control and Prevention. Ongoing. https://data.cdc.gov/.,2026-06-11T16:20:52.790810+00:00
BINGE_DRINKING,Binge drinking,Substance Use Prevalence and Outcomes,Estimated prevalence of binge drinking.,Estimates alcohol-related risk and supports substance-use prevention/treatment planning.,CDC PLACES,Centers for Disease Control and Prevention,API / Socrata,Cook,County,17,031,2023,2023,19.0,,,,percent,Percent of relevant adult population.,"CDC PLACES API metadata, normalized from source unit.",measure=Binge drinking among adults; measureid=BINGE; category=Health Risk Behaviors; short_question_text=Binge Drinking; data_value_type=Age-adjusted prevalence,Binge drinking among adults,Partial,Most recent matching CDC PLACES county row returned from tried Socrata endpoint; modeled estimate; validate endpoint/release before final reporting.,https://data.cdc.gov/resource/swc5-untb.json,CDC_PLACES_API,CDC PLACES API: CDC PLACES Local Data for Better Health. Centers for Disease Control and Prevention. Ongoing. https://data.cdc.gov/.,2026-06-11T16:20:52.791995+00:00
CURRENT_SMOKING,Current smoking,Physical Health and Co-occurring Conditions,Estimated prevalence of current smoking.,Supports integrated care assessment for co-occurring physical health risks.,CDC PLACES,Centers for Disease Control and Prevention,API / Socrata,Cook,County,17,031,2023,2023,11.1,,,,percent,Percent of relevant adult population.,"CDC PLACES API metadata, normalized from source unit.",measure=Current cigarette smoking among adults; measureid=CSMOKING; category=Health Risk Behaviors; short_question_text=Current Cigarette Smoking; data_value_type=Crude prevalence,Current cigarette smoking among adults,Partial,Most recent matching CDC PLACES county row returned from tried Socrata endpoint; modeled estimate; validate endpoint/release before final reporting.,https://data.cdc.gov/resource/swc5-untb.json,CDC_PLACES_API,CDC PLACES API: CDC PLACES Local Data for Better Health. Centers for Disease Control and Prevention. Ongoing. https://data.cdc.gov/.,2026-06-11T16:20:52.793233+00:00
MEDICAID_COVERAGE_RATE,Medicaid coverage rate,Insurance Coverage,Percentage of residents covered by Medicaid.,Medicaid-specific coverage may require ACS detailed tables or CMS/state administrative data. This script does not fabricate it from public-coverage data.,CMS Medicaid / ACS detailed Medicaid table,CMS / U.S. Census Bureau,Manual/API extension needed,"Cook County, Illinois",Service area,17,031,current source as of retrieval; manual/download connector needed,current source as of retrieval; manual/download connector needed,,,,,percent,"Medicaid-covered population divided by relevant population, multiplied by 100.",Placeholder; requires Medicaid-specific table or administrative source.,CMS Medicaid / ACS detailed Medicaid table: Medicaid-specific coverage may require ACS detailed tables or CMS/state administrative data. This script does not fabricate it from public-coverage data.,Total,No,"This indicator requires a source-specific connector, manual download, Medicaid-specific table, or internal data. No estimate was fabricated.",https://data.medicaid.gov/ or Medicaid-specific ACS detailed table,CENSUS_ACS_API,U.S. Census ACS API: American Community Survey API. U.S. Census Bureau. Ongoing. https://api.census.gov/data.html.,2026-06-11T16:20:52.793518+00:00
SUICIDE_MORTALITY,Suicide deaths and age-adjusted suicide mortality rate,Mental Health Prevalence and Outcomes,Suicide mortality burden.,Should include deaths and age-adjusted mortality rate once CDC WONDER/NVSS data are downloaded.,CDC WONDER / NVSS,Centers for Disease Control and Prevention,Manual download fallback,"Cook County, Illinois",Service area,17,031,current source as of retrieval; manual/download connector needed,current source as of retrieval; manual/download connector needed,,,,,"deaths per 100,000","Age-adjusted suicide deaths per 100,000 population.",Static indicator definition for CDC WONDER/NVSS mortality output.,CDC WONDER / NVSS: Should include deaths and age-adjusted mortality rate once CDC WONDER/NVSS data are downloaded.,Total,No,"This indicator requires a source-specific connector, manual download, Medicaid-specific table, or internal data. No estimate was fabricated.",https://wonder.cdc.gov/,CDC_WONDER_NVSS,"CDC WONDER / NVSS: CDC WONDER, National Vital Statistics System Mortality. Centers for Disease Control and Prevention. Ongoing. https://wonder.cdc.gov/.",2026-06-11T16:20:52.793762+00:00
