indicator_id,indicator_name,needs_assessment_domain,indicator_summary,indicator_detailed_description,source_name,source_agency,api_or_download,geography_name,geography_type,state_fips,county_fips,year_or_period,source_latest_year_or_period,estimate,moe,numerator,denominator,units,unit_definition,unit_source,source_variable_label,stratification,comparison_available,data_quality_note,source_url_or_endpoint,source_citation_id,source_citation_text,retrieved_at
OVERDOSE_MORTALITY,Drug overdose deaths and age-adjusted overdose mortality rate,Substance Use Prevalence and Outcomes,Drug overdose mortality burden.,Should include deaths and age-adjusted mortality rate once CDC WONDER/NVSS data are downloaded.,CDC WONDER / NVSS,Centers for Disease Control and Prevention,Manual download fallback,"Cook County, Illinois",Service area,17,031,current source as of retrieval; manual/download connector needed,current source as of retrieval; manual/download connector needed,,,,,"deaths per 100,000","Age-adjusted drug overdose deaths per 100,000 population.",Static indicator definition for CDC WONDER/NVSS mortality output.,CDC WONDER / NVSS: Should include deaths and age-adjusted mortality rate once CDC WONDER/NVSS data are downloaded.,Total,No,"This indicator requires a source-specific connector, manual download, Medicaid-specific table, or internal data. No estimate was fabricated.",https://wonder.cdc.gov/,CDC_WONDER_NVSS,"CDC WONDER / NVSS: CDC WONDER, National Vital Statistics System Mortality. Centers for Disease Control and Prevention. Ongoing. https://wonder.cdc.gov/.",2026-06-11T16:20:52.794004+00:00
MENTAL_HEALTH_HPSA,Mental Health HPSA status,Workforce and Provider Availability,Mental health professional shortage designation.,Identifies whether the service area or portions of it are designated as having mental health workforce shortages.,HRSA Data Warehouse,Health Resources and Services Administration,API / public files,"Cook County, Illinois",Service area,17,031,current source as of retrieval; manual/download connector needed,current source as of retrieval; manual/download connector needed,,,,,designation,Categorical shortage-area designation or related HPSA status/score.,Static indicator definition for HRSA HPSA output.,HRSA Data Warehouse: Identifies whether the service area or portions of it are designated as having mental health workforce shortages.,Total,No,"This indicator requires a source-specific connector, manual download, Medicaid-specific table, or internal data. No estimate was fabricated.",https://data.hrsa.gov/,HRSA_DATA_WAREHOUSE,HRSA Data Warehouse: HRSA Data Warehouse and Area Health Resource Files. Health Resources and Services Administration. Ongoing. https://data.hrsa.gov/.,2026-06-11T16:20:52.794245+00:00
TREATMENT_FACILITIES_MH,Mental health treatment facilities,Treatment Facilities and Service Infrastructure,Mental health treatment facility availability.,"Counts or lists mental health treatment facilities serving the geography, validated locally for access and capacity.",SAMHSA FindTreatment / N-SUMHSS,Substance Abuse and Mental Health Services Administration,Locator / public files,"Cook County, Illinois",Service area,17,031,current source as of retrieval; manual/download connector needed,current source as of retrieval; manual/download connector needed,,,,,facilities,Count of facilities or facility records.,Static indicator definition for SAMHSA facility files.,"SAMHSA FindTreatment / N-SUMHSS: Counts or lists mental health treatment facilities serving the geography, validated locally for access and capacity.",Total,No,"This indicator requires a source-specific connector, manual download, Medicaid-specific table, or internal data. No estimate was fabricated.",https://findtreatment.gov/,SAMHSA_FINDTREATMENT,SAMHSA FindTreatment / N-SUMHSS: SAMHSA Behavioral Health Treatment Locator and N-SUMHSS. Substance Abuse and Mental Health Services Administration. Ongoing. https://findtreatment.gov/.,2026-06-11T16:20:52.794488+00:00
TREATMENT_FACILITIES_SUD,SUD treatment facilities and MOUD availability,Treatment Facilities and Service Infrastructure,SUD treatment and MOUD service availability.,Counts/lists SUD treatment facilities and MOUD capacity to identify SUD continuum gaps.,SAMHSA FindTreatment / N-SUMHSS,Substance Abuse and Mental Health Services Administration,Locator / public files,"Cook County, Illinois",Service area,17,031,current source as of retrieval; manual/download connector needed,current source as of retrieval; manual/download connector needed,,,,,facilities,Count of facilities or facility records.,Static indicator definition for SAMHSA facility files.,SAMHSA FindTreatment / N-SUMHSS: Counts/lists SUD treatment facilities and MOUD capacity to identify SUD continuum gaps.,Total,No,"This indicator requires a source-specific connector, manual download, Medicaid-specific table, or internal data. No estimate was fabricated.",https://findtreatment.gov/,SAMHSA_FINDTREATMENT,SAMHSA FindTreatment / N-SUMHSS: SAMHSA Behavioral Health Treatment Locator and N-SUMHSS. Substance Abuse and Mental Health Services Administration. Ongoing. https://findtreatment.gov/.,2026-06-11T16:20:52.794730+00:00
HOMELESSNESS_PIT,People experiencing homelessness,Housing Stability,Homelessness count.,Uses HUD PIT/HIC or local PIT data to estimate people experiencing homelessness.,HUD PIT/HIC,U.S. Department of Housing and Urban Development,Public download,"Cook County, Illinois",Service area,17,031,current source as of retrieval; manual/download connector needed,current source as of retrieval; manual/download connector needed,,,,,people,Number of people counted as experiencing homelessness.,Static indicator definition for HUD PIT/HIC output.,HUD PIT/HIC: Uses HUD PIT/HIC or local PIT data to estimate people experiencing homelessness.,Total,No,"This indicator requires a source-specific connector, manual download, Medicaid-specific table, or internal data. No estimate was fabricated.",https://www.hudexchange.info/programs/hdx/pit-hic/,HUD_PIT_HIC,HUD PIT/HIC: Point-in-Time Count and Housing Inventory Count. U.S. Department of Housing and Urban Development. Annual. https://www.hudexchange.info/programs/hdx/pit-hic/.,2026-06-11T16:20:52.794971+00:00
SCHOOL_ENROLLMENT,School enrollment and student demographics,"Children, Youth, and Families",Student enrollment.,"Supports youth population context, school partnerships, and school-based behavioral health access planning.",NCES Common Core of Data,National Center for Education Statistics,API / public files,"Cook County, Illinois",Service area,17,031,current source as of retrieval; manual/download connector needed,current source as of retrieval; manual/download connector needed,,,,,students,Number of enrolled students.,Static indicator definition for NCES CCD output.,"NCES Common Core of Data: Supports youth population context, school partnerships, and school-based behavioral health access planning.",Total,No,"This indicator requires a source-specific connector, manual download, Medicaid-specific table, or internal data. No estimate was fabricated.",https://nces.ed.gov/ccd/,NCES_CCD,NCES Common Core of Data: Common Core of Data. National Center for Education Statistics. Ongoing. https://nces.ed.gov/ccd/.,2026-06-11T16:20:52.795213+00:00
CLIENT_DEMOGRAPHICS,CCBHC client demographics,Underserved Populations,Client demographic profile.,Internal indicator needed to compare served population with service area population.,Internal EHR / client data,Client organization,Internal file,"Cook County, Illinois",Service area,17,031,current source as of retrieval; manual/download connector needed,current source as of retrieval; manual/download connector needed,,,,,clients,"Number or percentage of clients, depending on internal file.",Internal data placeholder.,Internal EHR / client data: Internal indicator needed to compare served population with service area population.,Total,No,"This indicator requires a source-specific connector, manual download, Medicaid-specific table, or internal data. No estimate was fabricated.",Not available through government API,INTERNAL_PLACEHOLDER,Internal organization data placeholder: Internal CCBHC data placeholder. Client organization. Project-specific. Not available through government API.,2026-06-11T16:20:52.795456+00:00
SERVICE_UTILIZATION,"Service utilization, referrals, wait times, no-shows",Access to Care,Service access and operational utilization.,Captures actual access patterns and bottlenecks.,Internal operations data,Client organization,Internal file,"Cook County, Illinois",Service area,17,031,current source as of retrieval; manual/download connector needed,current source as of retrieval; manual/download connector needed,,,,,varies,"Depends on internal field: visits, clients, days, referrals, or percent.",Internal data placeholder.,Internal operations data: Captures actual access patterns and bottlenecks.,Total,No,"This indicator requires a source-specific connector, manual download, Medicaid-specific table, or internal data. No estimate was fabricated.",Not available through government API,INTERNAL_PLACEHOLDER,Internal organization data placeholder: Internal CCBHC data placeholder. Client organization. Project-specific. Not available through government API.,2026-06-11T16:20:52.795698+00:00
STAFFING_PLAN,"Staffing plan, FTEs, credentials, turnover, training",Staffing Implications,Staffing capacity and alignment.,"Links CNA findings to staffing changes, roles, credentials, language capacity, peer roles, and care coordination.",Internal staffing plan,Client organization,Internal file,"Cook County, Illinois",Service area,17,031,current source as of retrieval; manual/download connector needed,current source as of retrieval; manual/download connector needed,,,,,FTE / roles,"Full-time equivalents, positions, credentials, vacancies, turnover, or training counts.",Internal data placeholder.,"Internal staffing plan: Links CNA findings to staffing changes, roles, credentials, language capacity, peer roles, and care coordination.",Total,No,"This indicator requires a source-specific connector, manual download, Medicaid-specific table, or internal data. No estimate was fabricated.",Not available through government API,INTERNAL_PLACEHOLDER,Internal organization data placeholder: Internal CCBHC data placeholder. Client organization. Project-specific. Not available through government API.,2026-06-11T16:20:52.795939+00:00
QUALITATIVE_THEMES,"Interview, focus group, advisory board, and survey themes",Qualitative Findings,Themes from primary qualitative research.,"Captures stakeholder, client, partner, and community perspectives explaining quantitative trends.",Primary qualitative research,Client organization / consultant,Internal file,"Cook County, Illinois",Service area,17,031,current source as of retrieval; manual/download connector needed,current source as of retrieval; manual/download connector needed,,,,,themes,"Qualitative themes, coded findings, quotes, or theme counts.",Internal qualitative analysis placeholder.,"Primary qualitative research: Captures stakeholder, client, partner, and community perspectives explaining quantitative trends.",Total,No,"This indicator requires a source-specific connector, manual download, Medicaid-specific table, or internal data. No estimate was fabricated.",Not available through government API,CCBHC_TOOLKIT_2024,CCBHC CNA Toolkit: CCBHC Community Needs Assessment Toolkit. National Council for Mental Wellbeing / CCBHC-E NTTAC. 2024-01. CCBHC-Needs-Assessment-Toolkit.pdf.,2026-06-11T16:20:52.796176+00:00
